{
  "schema_version": "trajecta.m6.physics-contract/v1",
  "contract_id": "trajecta/physics/m6/v1",
  "versions": {
    "software": "0.1.0-alpha.1",
    "case_schema": 0,
    "sqlite_user_version": 2
  },
  "configuration": {
    "absent_physics": "pure_advection",
    "merge_order": [
      "expand_preset",
      "apply_remove",
      "apply_sparse_overrides",
      "append_modules",
      "validate_uniqueness_order_and_dependencies"
    ],
    "legacy_fields_rejected": ["enabled", "parameters"],
    "explicit_order_policy": "all_or_none_unique_contiguous_dependency_valid",
    "unknown_remove_policy": "error_with_field_path",
    "unknown_override_policy": "error_with_field_path",
    "duplicate_module_policy": "error_with_field_path",
    "quantity_policy": "explicit_unit_normalized_to_si_no_bare_dimensional_number",
    "configuration_shape": {
      "preset": "water_vapor_tracking",
      "remove": [],
      "overrides": [
        {
          "model": "boundary_layer_langevin",
          "maximum_substep": "30 s"
        }
      ],
      "modules": []
    }
  },
  "substances": {
    "kinds": ["water_vapor", "gas", "aerosol"],
    "water_vapor_required_fields": ["display_name", "id", "kind"],
    "gas_required_fields": [
      "display_name",
      "henry_constant",
      "id",
      "kind",
      "molar_mass",
      "surface_reactivity"
    ],
    "gas_optional_fields": [
      "half_life",
      "oh_reaction"
    ],
    "aerosol_required_fields": [
      "diameter",
      "display_name",
      "id",
      "kind",
      "material_density",
      "shape"
    ],
    "diameter_range_micrometre": {
      "minimum": 0.01,
      "maximum": 100.0
    },
    "diameter_distribution": "truncated_lognormal_mass_basis/v1",
    "diameter_sample_policy": "once_at_birth_counter_rng_then_immutable",
    "forward_state": "per_substance_mass_kg",
    "backward_state": "per_substance_adjoint_weight",
    "oh_rate_formula": "A*(T/300K)^n*exp(-activation_temperature/T)*OH"
  },
  "modules": [
    {
      "id": "emission_time_profile",
      "stage": "m6_a7",
      "phase": "source_schedule",
      "algorithm_id": "normalized_emission_calendar/v1",
      "stochastic": false,
      "event_policy": "aggregate_particle_module_substance_macro_step",
      "substance_kinds": ["aerosol", "gas", "water_vapor"],
      "requires_modules": [],
      "requires_capabilities": ["case.emission_source", "time.iana_zone"],
      "override_fields": ["hourly_factors", "monthly_factors", "normalization", "time_series", "time_zone", "weekday_factors"],
      "parameter_contracts": [
        {"name": "time_zone", "wire_type": "enum", "unit": null, "required": true, "default": null, "minimum_si": null, "maximum_si": null, "allowed_values": ["iana_time_zone", "utc"]},
        {"name": "normalization", "wire_type": "enum", "unit": null, "required": true, "default": null, "minimum_si": null, "maximum_si": null, "allowed_values": ["preserve_declared_total", "preserve_rate_amplitude"]},
        {"name": "monthly_factors", "wire_type": "factor_array", "unit": "1", "required": false, "default": [], "minimum_si": 0.0, "maximum_si": null},
        {"name": "weekday_factors", "wire_type": "factor_array", "unit": "1", "required": false, "default": [], "minimum_si": 0.0, "maximum_si": null},
        {"name": "hourly_factors", "wire_type": "factor_array", "unit": "1", "required": false, "default": [], "minimum_si": 0.0, "maximum_si": null},
        {"name": "time_series", "wire_type": "time_series", "unit": "kg/s", "required": false, "default": [], "minimum_si": 0.0, "maximum_si": null}
      ],
      "scientific_references": [
        {"citation": "Trajecta M6 normalized source-schedule contract", "doi": null, "role": "calendar composition and exact total normalization"}
      ]
    },
    {
      "id": "buoyant_plume_rise",
      "stage": "m6_a7",
      "phase": "birth_column",
      "algorithm_id": "entraining_buoyant_plume_column/v1",
      "stochastic": false,
      "event_policy": "aggregate_particle_module_substance_macro_step",
      "substance_kinds": ["aerosol", "gas", "water_vapor"],
      "requires_modules": ["emission_time_profile"],
      "requires_capabilities": ["met.air_density", "met.air_temperature", "met.horizontal_wind", "met.pressure", "source.buoyancy"],
      "override_fields": ["entrainment_coefficient", "maximum_substep"],
      "parameter_contracts": [
        {"name": "entrainment_coefficient", "wire_type": "finite_number", "unit": "1", "required": false, "default": 0.1, "minimum_si": 0.01, "maximum_si": 0.3},
        {"name": "maximum_substep", "wire_type": "quantity", "unit": "s", "required": false, "default": "30 s", "minimum_si": 0.001, "maximum_si": 300.0}
      ],
      "scientific_references": [
        {"citation": "Morton, Taylor and Turner (1956), Turbulent gravitational convection from maintained and instantaneous sources", "doi": "10.1098/rspa.1956.0011", "role": "entraining plume equations"},
        {"citation": "Freitas et al. (2007), Including the sub-grid scale plume rise of vegetation fires in low resolution atmospheric transport models", "doi": "10.5194/acp-7-3385-2007", "role": "atmospheric plume-column application"}
      ]
    },
    {
      "id": "subgrid_orography",
      "stage": "m6_a2",
      "phase": "field_modifier",
      "algorithm_id": "gmted2010_grid_anomaly_and_mixing_enhancement/v1",
      "stochastic": false,
      "event_policy": "none_continuous_summary_only",
      "substance_kinds": ["aerosol", "gas", "water_vapor"],
      "requires_modules": [],
      "requires_capabilities": ["aux.gmted2010_mean", "aux.gmted2010_standard_deviation", "met.boundary_layer_height", "met.brunt_vaisala_frequency", "met.terrain_height", "met.wind_speed"],
      "override_fields": ["maximum_substep"],
      "parameter_contracts": [
        {"name": "maximum_substep", "wire_type": "quantity", "unit": "s", "required": false, "default": "300 s", "minimum_si": 0.001, "maximum_si": 900.0}
      ],
      "scientific_references": [
        {"citation": "Stohl et al. (2005), Technical note: The Lagrangian particle dispersion model FLEXPART version 6.2", "doi": "10.5194/acp-5-2461-2005", "role": "sub-grid terrain and mixing-height formulation"}
      ]
    },
    {
      "id": "boundary_layer_langevin",
      "stage": "m6_a1",
      "phase": "motion_velocity",
      "algorithm_id": "thomson_hanna_skewed_cbl_langevin/v1",
      "stochastic": true,
      "event_policy": "none_continuous_summary_only",
      "substance_kinds": ["aerosol", "gas", "water_vapor"],
      "requires_modules": [],
      "requires_capabilities": ["met.boundary_layer_height", "met.friction_velocity", "met.monin_obukhov_length", "met.sensible_heat_flux", "met.surface_roughness", "met.temperature"],
      "override_fields": ["maximum_substep"],
      "parameter_contracts": [
        {"name": "maximum_substep", "wire_type": "quantity", "unit": "s", "required": false, "default": "30 s", "minimum_si": 0.001, "maximum_si": 120.0}
      ],
      "scientific_references": [
        {"citation": "Thomson (1987), Criteria for the selection of stochastic models of particle trajectories in turbulent flows", "doi": "10.1017/S0022112087001940", "role": "well-mixed stochastic model"},
        {"citation": "Luhar and Britter (1989), A random walk model for dispersion in inhomogeneous turbulence in a convective boundary layer", "doi": "10.1016/0004-6981(89)90516-7", "role": "skewed convective boundary-layer velocity"},
        {"citation": "Cassiani et al. (2015), Stochastic Lagrangian models of turbulent dispersion in convective boundary layers", "doi": "10.1007/s10546-014-9976-5", "role": "non-Gaussian convective boundary-layer evaluation"}
      ]
    },
    {
      "id": "mesoscale_markov",
      "stage": "m6_a2",
      "phase": "motion_velocity",
      "algorithm_id": "three_dimensional_local_variance_ou/v1",
      "stochastic": true,
      "event_policy": "none_continuous_summary_only",
      "substance_kinds": ["aerosol", "gas", "water_vapor"],
      "requires_modules": [],
      "requires_capabilities": ["met.native_time_interval", "met.wind_local_spacetime_variance"],
      "override_fields": ["correlation_interval_fraction", "maximum_substep"],
      "parameter_contracts": [
        {"name": "correlation_interval_fraction", "wire_type": "finite_number", "unit": "1", "required": false, "default": 0.5, "minimum_si": 0.05, "maximum_si": 1.0},
        {"name": "maximum_substep", "wire_type": "quantity", "unit": "s", "required": false, "default": "300 s", "minimum_si": 0.001, "maximum_si": 900.0}
      ],
      "scientific_references": [
        {"citation": "Stohl et al. (2005), Technical note: The Lagrangian particle dispersion model FLEXPART version 6.2", "doi": "10.5194/acp-5-2461-2005", "role": "mesoscale velocity perturbation structure"}
      ]
    },
    {
      "id": "gravitational_settling",
      "stage": "m6_a5",
      "phase": "motion_velocity",
      "algorithm_id": "cunningham_cross_reynolds_terminal_velocity/v1",
      "stochastic": false,
      "event_policy": "none_continuous_summary_only",
      "substance_kinds": ["aerosol"],
      "requires_modules": [],
      "requires_capabilities": ["met.air_density", "met.air_temperature", "met.pressure"],
      "override_fields": ["maximum_substep"],
      "parameter_contracts": [
        {"name": "maximum_substep", "wire_type": "quantity", "unit": "s", "required": false, "default": "60 s", "minimum_si": 0.001, "maximum_si": 300.0}
      ],
      "scientific_references": [
        {"citation": "Clift, Grace and Weber (1978), Bubbles, Drops, and Particles", "doi": null, "role": "cross-Reynolds-number drag law"},
        {"citation": "Seinfeld and Pandis (2016), Atmospheric Chemistry and Physics, third edition", "doi": null, "role": "Cunningham slip correction and aerosol settling"}
      ]
    },
    {
      "id": "deep_convection_column",
      "stage": "m6_a3",
      "phase": "column_transfer",